objective_id,period,objective,success_measure,target,target_unit,target_date,communardo_priority,atlassian_priority,status,progress_method,progress_pct,linked_activities,linked_evidence,at_risk_reason,recovery_action,completed_at,completion_note,missed_at,missed_reason,vendor,visibility,created_at,updated_at,created_by,updated_by,notes
OBJ-0001,2026-Q3,"Establish Atlassian partnership KPIs, reporting structure, and dashboards","Group Revenue Operations-aligned KPI set, reporting cadence, and dashboard live and adopted by regional teams",,,2026-09-30,high,medium,on_track,manual,0,,,,,,,,,Atlassian,communardo_internal,2026-07-21T17:18:06,2026-07-21T17:18:06,Steve Mojsak,Steve Mojsak,"From Partner Alliance Manager (Atlassian) JD, Responsibility 1: Partner Lifecycle & Operational Excellence"
OBJ-0002,2026-Q3,"Stand up rigorous deal registration, licensing, and quoting processes across regions","Documented, repeatable deal registration/licensing/quoting playbook landed and followed in DACH, Nordics, and Benelux",,,2026-09-30,high,high,on_track,manual,0,,,,,,,,,Atlassian,communardo_internal,2026-07-21T17:18:06,2026-07-21T17:18:06,Steve Mojsak,Steve Mojsak,"From Partner Alliance Manager (Atlassian) JD, Responsibility 1: Partner Lifecycle & Operational Excellence"
OBJ-0003,2026-Q3,Embed Atlassian partner-driven deals into One CRM with high forecast accuracy,All Atlassian partner-related deals embedded in One CRM with accurate stage/forecast data; forecast variance tracked against actuals,,,2026-09-30,high,medium,on_track,manual,0,,,,,,,,,Atlassian,communardo_internal,2026-07-21T17:18:06,2026-07-21T17:18:06,Steve Mojsak,Steve Mojsak,"From Partner Alliance Manager (Atlassian) JD, Responsibility 2: Pipeline, Forecasting & Co-Sell Execution / Success Measures"
OBJ-0004,2026-Q3,Deliver a joint business plan with Atlassian aligned to Group GTM,"First quarterly joint business plan completed with Atlassian, with clear growth targets and sign-off on Group GTM alignment",,,2026-09-30,high,high,on_track,manual,0,,,,,,,,,Atlassian,communardo_internal,2026-07-21T17:18:06,2026-07-21T17:18:06,Steve Mojsak,Steve Mojsak,"From Partner Alliance Manager (Atlassian) JD, Responsibility 3: GTM Alignment & Partner Strategy"
OBJ-0005,2026,Grow Atlassian partner-sourced and co-sold revenue contribution,Increased partner-sourced and co-sold revenue contribution to the Group commercial engine (12-24 month success measure; 2026 is the first-year checkpoint),,,2026-12-31,high,high,on_track,manual,0,,,,,,,,,Atlassian,communardo_internal,2026-07-21T17:18:20,2026-07-21T17:18:20,Steve Mojsak,Steve Mojsak,"From Partner Alliance Manager (Atlassian) JD, Success Measures (12-24 months)"
OBJ-0006,2026,Improve pipeline coverage and conversion rates for Atlassian-related deals,Demonstrated improvement in pipeline coverage ratio and win-rate for Atlassian co-sell opportunities vs. 2026 baseline,,,2026-12-31,high,high,on_track,manual,0,,,,,,,,,Atlassian,communardo_internal,2026-07-21T17:18:20,2026-07-21T17:18:20,Steve Mojsak,Steve Mojsak,"From Partner Alliance Manager (Atlassian) JD, Responsibility 2 / Success Measures (12-24 months)"
OBJ-0007,2026,Drive internal adoption of Atlassian partner motions across all regions,"Sales, Marketing, and Delivery teams across DACH, Nordics, and Benelux trained and actively using partner-centric selling motions",,,2026-12-31,medium,medium,on_track,manual,0,,,,,,,,,Atlassian,communardo_internal,2026-07-21T17:18:20,2026-07-21T17:18:20,Steve Mojsak,Steve Mojsak,"From Partner Alliance Manager (Atlassian) JD, Responsibility 5: Internal Enablement & Communication / Success Measures"
OBJ-0008,2026,Elevate Communardo's strategic positioning with Atlassian,"Recognised by Atlassian as a strategic, high-performing partner; strengthened relationships across Atlassian sales, partner management, and leadership layers",,,2026-12-31,high,high,on_track,manual,0,,,,,,,,,Atlassian,communardo_internal,2026-07-21T17:18:20,2026-07-21T17:18:20,Steve Mojsak,Steve Mojsak,"From Partner Alliance Manager (Atlassian) JD, Responsibility 6: Partner Relationship Management / Success Measures"
