vendor,quarter,sub_metric,weight_pct_in_category,target,actual,unit,score_method,source,notes,description
Atlassian,2026-Q3,Pipeline growth QoQ,35,500000,0,EUR,ratio,,RESET 2026-07-01 — awaiting real data,"Net new pipeline value created this quarter vs last, sourced from CRM. Signals whether top-of-funnel demand generation is keeping pace with targets."
Atlassian,2026-Q3,Bookings/revenue attainment vs quota,40,1200000,0,EUR,ratio,,RESET 2026-07-01 — awaiting real data,Closed-won bookings this quarter against the quota set with Atlassian/leadership. The single clearest signal of commercial performance.
Atlassian,2026-Q3,Win rate on registered deals,25,35,0,%,ratio,,RESET 2026-07-01 — awaiting real data,Percentage of Deal-Registered opportunities that closed won. Reflects how effectively registered pipeline converts to revenue.
catworkx DE (TEST DATA),2026-Q3,Pipeline growth QoQ,35,12700000,14900000,USD,ratio,Partner Value Scorecard screenshot (TEST),TEST DATA — pipeline validation only,"Mapped from the scorecard's 'Sourced Net New ACV Pipegen' row (Target $12.7M / Actuals $14.9M)."
catworkx DE (TEST DATA),2026-Q3,Bookings/revenue attainment vs quota,40,31000000,44100000,USD,ratio,Partner Value Scorecard screenshot (TEST),TEST DATA — pipeline validation only,"Mapped from the scorecard's 'Contributed Net New ACV' row (Target $31.0M / Actuals $44.1M)."
catworkx DE (TEST DATA),2026-Q3,Win rate on registered deals,25,35,0,%,ratio,,TEST DATA — pipeline validation only; no matching figure on the scorecard,"No corresponding figure on the source scorecard, left at 0 for this test vendor."
